{
  "request_id": "NR-PV-0001",
  "version": 1,
  "run_id": "RUN-EXAMPLE-001",
  "parent_work_item": "WI-RUN-EXAMPLE-001",
  "raised_by": "[ORG]CELL-TCS",
  "type": "decision",
  "question_plain": "Is this the organisation's purpose, as you want it stated in the operating model?",
  "question_original": "Purpose-and-values row 1 of the decision sheet.",
  "asking_form": {
    "form": "decision row",
    "decision": "Accept the purpose statement as drafted from the founding documents",
    "options": [
      "ACCEPT",
      "CORRECT",
      "REJECT"
    ]
  },
  "why_it_matters": "Every capability of the model serves the purpose; only the governing seat sets it (HF-04).",
  "blocks": "gate T8",
  "effect_of_answer": "Fixes the purpose every capability serves.",
  "if_unanswered": {
    "carried_as": "unknown",
    "cost": "Gate T8 cannot pass; no release."
  },
  "minimality_proof": {
    "searched": [
      {
        "source_id": "SRC-ARTICLES",
        "held": "held",
        "version": "1",
        "sha256": "76b809a01069ff7d9f42f0ca33b04dbeb0cfaccc2e53cc62229a1c87e1eede56",
        "location": "[ORG]AIOC-SL output socket @ SLM-0600aba3e5d8a927341ce6fe09ff9257309c0448fb6397fedf689cd05a6c284f",
        "snapshot_id": "SLM-0600aba3e5d8a927341ce6fe09ff9257309c0448fb6397fedf689cd05a6c284f",
        "origin_kind": "document",
        "status": "in force",
        "confidentiality": "internal",
        "anchor": "s2"
      }
    ],
    "why_unanswered": "The articles state objects of the company, not the purpose as the organisation wants it stated in the operating model."
  },
  "leverage": {
    "breadth": "high",
    "irreversibility": "medium",
    "cost_of_being_wrong": "high"
  },
  "non_delegable": true,
  "depends_on": [],
  "pass_id": "PASS-1",
  "row": 1,
  "due": "2026-11-01",
  "missing_report_ref": "MR-RUN-EXAMPLE-001-1",
  "answering_cell": "[ORG]CELL-GOV",
  "listed_type": "set-purpose-or-values"
}
