{
  "request_id": "NR-CF-0010",
  "version": 1,
  "run_id": "RUN-EXAMPLE-001",
  "parent_work_item": "WI-RUN-EXAMPLE-001",
  "raised_by": "[ORG]POD-TRR",
  "type": "confirmation",
  "question_plain": "This is how we read your request: you want a model of how the company should work after it takes over its sister company's customers, starting with sales and finance. Please confirm, correct it in your own words, or say you don't know.",
  "question_original": "Understanding check of the frame, frame decision pass 1.",
  "asking_form": {
    "form": "confirmation row",
    "inferred_item": "The request is to design the operating model of the company after it takes over the sister company's customers; sales and finance first.",
    "inferred_from": [
      {
        "source_id": "SRC-DRQ-0001",
        "held": "held",
        "version": "1",
        "sha256": "1b1e83f7e32717fb16ab388d1b639ad589d2387a4b7a39c63e93fd36fb3ea9a8",
        "location": "[ORG]AIOC-SL output socket @ SLM-0600aba3e5d8a927341ce6fe09ff9257309c0448fb6397fedf689cd05a6c284f",
        "snapshot_id": "SLM-0600aba3e5d8a927341ce6fe09ff9257309c0448fb6397fedf689cd05a6c284f",
        "origin_kind": "explainer",
        "status": "in force",
        "confidentiality": "internal"
      }
    ],
    "row_purpose": "understanding check"
  },
  "why_it_matters": "Every later step rests on this reading of the request.",
  "blocks": "Design Brief frame; gate T1",
  "effect_of_answer": "Confirms the frame, or corrects it before any decision row is decided.",
  "if_unanswered": {
    "carried_as": "assumption",
    "cost": "The frame rests on this reading without the organisation's confirmation."
  },
  "minimality_proof": {
    "searched": [
      {
        "source_id": "SRC-DRQ-0001",
        "held": "held",
        "version": "1",
        "sha256": "1b1e83f7e32717fb16ab388d1b639ad589d2387a4b7a39c63e93fd36fb3ea9a8",
        "location": "[ORG]AIOC-SL output socket @ SLM-0600aba3e5d8a927341ce6fe09ff9257309c0448fb6397fedf689cd05a6c284f",
        "snapshot_id": "SLM-0600aba3e5d8a927341ce6fe09ff9257309c0448fb6397fedf689cd05a6c284f",
        "origin_kind": "explainer",
        "status": "in force",
        "confidentiality": "internal"
      }
    ],
    "why_unanswered": "Only the organisation can say whether this is how it reads its own request."
  },
  "leverage": {
    "breadth": "high",
    "irreversibility": "medium",
    "cost_of_being_wrong": "high"
  },
  "suggested_seat": {
    "role_as_named": "the managing director, as the Design Request names the role",
    "citation": {
      "source_id": "SRC-DRQ-0001",
      "held": "held",
      "version": "1",
      "sha256": "1b1e83f7e32717fb16ab388d1b639ad589d2387a4b7a39c63e93fd36fb3ea9a8",
      "location": "[ORG]AIOC-SL output socket @ SLM-0600aba3e5d8a927341ce6fe09ff9257309c0448fb6397fedf689cd05a6c284f",
      "snapshot_id": "SLM-0600aba3e5d8a927341ce6fe09ff9257309c0448fb6397fedf689cd05a6c284f",
      "origin_kind": "explainer",
      "status": "in force",
      "confidentiality": "internal",
      "anchor": "f1"
    }
  },
  "non_delegable": false,
  "depends_on": [],
  "pass_id": "PASS-1",
  "row": 5,
  "due": "2026-11-01",
  "missing_report_ref": "MR-RUN-EXAMPLE-001-1"
}
