{
  "request_id": "NR-RD-0001",
  "version": 1,
  "run_id": "RUN-EXAMPLE-001",
  "parent_work_item": "WI-RUN-EXAMPLE-001",
  "raised_by": "[ORG]POD-TRR",
  "type": "decision",
  "question_plain": "Your request can be read in two ways. A: the design covers the sales unit only. B: it covers sales and customer service together. Which is your request?",
  "question_original": "Frame scope, item 3: two independent drafts read the Design Request differently and the cited passages do not settle it (difference DIF-4).",
  "asking_form": {
    "form": "decision row",
    "decision": "Which reading of the request is the scope of this design",
    "options": [
      "reading A",
      "reading B",
      "both readings",
      "dont know"
    ]
  },
  "why_it_matters": "The scope decides which parts are designed.",
  "blocks": "gate T1",
  "effect_of_answer": "Fixes the scope row of the frame.",
  "if_unanswered": {
    "carried_as": "unknown",
    "cost": "Gate T1 cannot pass."
  },
  "minimality_proof": {
    "searched": [
      {
        "source_id": "SRC-ARTICLES",
        "held": "held",
        "version": "1",
        "sha256": "76b809a01069ff7d9f42f0ca33b04dbeb0cfaccc2e53cc62229a1c87e1eede56",
        "location": "[ORG]AIOC-SL output socket @ SLM-0600aba3e5d8a927341ce6fe09ff9257309c0448fb6397fedf689cd05a6c284f",
        "snapshot_id": "SLM-0600aba3e5d8a927341ce6fe09ff9257309c0448fb6397fedf689cd05a6c284f",
        "origin_kind": "document",
        "status": "in force",
        "confidentiality": "internal",
        "anchor": "s2"
      }
    ],
    "why_unanswered": "The articles state objects of the company, not the purpose as the organisation wants it stated in the operating model."
  },
  "leverage": {
    "breadth": "high",
    "irreversibility": "medium",
    "cost_of_being_wrong": "high"
  },
  "non_delegable": true,
  "depends_on": [],
  "pass_id": "PASS-1",
  "row": 1,
  "due": "2026-11-01",
  "missing_report_ref": "MR-RUN-EXAMPLE-001-1",
  "answering_cell": "[ORG]CELL-GOV"
}
